{
  "$schema": "http://json-schema.org/draft-07/schema#",
  "title": "Context-fit score for a candidate replacement",
  "type": "object",
  "additionalProperties": false,
  "required": ["fit_score", "rationale", "supports_claim", "confidence", "concerns"],
  "properties": {
    "fit_score": {"type": "integer", "minimum": 0, "maximum": 10},
    "rationale": {"type": "string"},
    "supports_claim": {"type": "boolean"},
    "confidence": {"type": "number", "minimum": 0.0, "maximum": 1.0},
    "concerns": {"type": "array", "items": {"type": "string"}}
  }
}
